{
  "$schema": "./levels-difficulty-index.schema.json",
  "version": "1.0.0",
  "generatedAt": "2026-01-24T21:22:16.763Z",
  "totalLevels": 20,
  "difficulties": {
    "easy": {
      "count": 20,
      "totalXP": 2135,
      "levels": [
        {
          "id": "level_01_easy",
          "baseId": "level_01",
          "tier": "tier_1",
          "title": "The Simple Wire",
          "inputs": 1,
          "maxGates": 1,
          "xpReward": 10,
          "gateCount": 0,
          "file": "level_01_easy.json"
        },
        {
          "id": "level_02_easy",
          "baseId": "level_02",
          "tier": "tier_1",
          "title": "The Transistor",
          "inputs": 2,
          "maxGates": 1,
          "xpReward": 15,
          "gateCount": 1,
          "file": "level_02_easy.json"
        },
        {
          "id": "level_03_easy",
          "baseId": "level_03",
          "tier": "tier_1",
          "title": "The Inverter (NOT)",
          "inputs": 1,
          "maxGates": 1,
          "xpReward": 20,
          "gateCount": 2,
          "file": "level_03_easy.json"
        },
        {
          "id": "level_04_easy",
          "baseId": "level_04",
          "tier": "tier_1",
          "title": "AND Gate",
          "inputs": 2,
          "maxGates": 1,
          "xpReward": 25,
          "gateCount": 3,
          "file": "level_04_easy.json"
        },
        {
          "id": "level_05_easy",
          "baseId": "level_05",
          "tier": "tier_1",
          "title": "OR Gate",
          "inputs": 2,
          "maxGates": 1,
          "xpReward": 25,
          "gateCount": 4,
          "file": "level_05_easy.json"
        },
        {
          "id": "level_06_easy",
          "baseId": "level_06",
          "tier": "tier_2",
          "title": "NAND: The Universal",
          "inputs": 2,
          "maxGates": 1,
          "xpReward": 30,
          "gateCount": 5,
          "file": "level_06_easy.json"
        },
        {
          "id": "level_07_easy",
          "baseId": "level_07",
          "tier": "tier_2",
          "title": "Logic from NAND",
          "inputs": 1,
          "maxGates": 1,
          "xpReward": 40,
          "gateCount": 6,
          "file": "level_07_easy.json"
        },
        {
          "id": "level_08_easy",
          "baseId": "level_08",
          "tier": "tier_2",
          "title": "XOR (Exclusive OR)",
          "inputs": 2,
          "maxGates": 4,
          "xpReward": 50,
          "gateCount": 7,
          "file": "level_08_easy.json"
        },
        {
          "id": "level_09_easy",
          "baseId": "level_09",
          "tier": "tier_2",
          "title": "De Morgan Laws",
          "inputs": 2,
          "maxGates": 3,
          "xpReward": 60,
          "gateCount": 7,
          "file": "level_09_easy.json"
        },
        {
          "id": "level_10_easy",
          "baseId": "level_10",
          "tier": "tier_3",
          "title": "Multiplexer (MUX)",
          "inputs": 3,
          "maxGates": 4,
          "xpReward": 70,
          "gateCount": 8,
          "file": "level_10_easy.json"
        },
        {
          "id": "level_11_easy",
          "baseId": "level_11",
          "tier": "tier_3",
          "title": "Decoder (2-to-4)",
          "inputs": 2,
          "maxGates": 6,
          "xpReward": 80,
          "gateCount": 8,
          "file": "level_11_easy.json"
        },
        {
          "id": "level_12_easy",
          "baseId": "level_12",
          "tier": "tier_3",
          "title": "Half Adder",
          "inputs": 2,
          "maxGates": 2,
          "xpReward": 90,
          "gateCount": 8,
          "file": "level_12_easy.json"
        },
        {
          "id": "level_13_easy",
          "baseId": "level_13",
          "tier": "tier_3",
          "title": "Full Adder",
          "inputs": 3,
          "maxGates": 5,
          "xpReward": 100,
          "gateCount": 8,
          "file": "level_13_easy.json"
        },
        {
          "id": "level_14_easy",
          "baseId": "level_14",
          "tier": "tier_4",
          "title": "SR Latch",
          "inputs": 2,
          "maxGates": 1,
          "xpReward": 100,
          "gateCount": 9,
          "file": "level_14_easy.json"
        },
        {
          "id": "level_15_easy",
          "baseId": "level_15",
          "tier": "tier_4",
          "title": "D Flip-Flop",
          "inputs": 2,
          "maxGates": 1,
          "xpReward": 120,
          "gateCount": 10,
          "file": "level_15_easy.json"
        },
        {
          "id": "level_16_easy",
          "baseId": "level_16",
          "tier": "tier_4",
          "title": "Toggle Flip-Flop",
          "inputs": 1,
          "maxGates": 1,
          "xpReward": 140,
          "gateCount": 10,
          "file": "level_16_easy.json"
        },
        {
          "id": "level_17_easy",
          "baseId": "level_17",
          "tier": "tier_5",
          "title": "2-Bit Counter",
          "inputs": 1,
          "maxGates": 4,
          "xpReward": 160,
          "gateCount": 10,
          "file": "level_17_easy.json"
        },
        {
          "id": "level_18_easy",
          "baseId": "level_18",
          "tier": "tier_5",
          "title": "Traffic Light Controller",
          "inputs": 1,
          "maxGates": 10,
          "xpReward": 200,
          "gateCount": 10,
          "file": "level_18_easy.json"
        },
        {
          "id": "level_19_easy",
          "baseId": "level_19",
          "tier": "tier_6",
          "title": "Arithmetic Logic Unit",
          "inputs": 3,
          "maxGates": 10,
          "xpReward": 300,
          "gateCount": 11,
          "file": "level_19_easy.json"
        },
        {
          "id": "level_boss_easy",
          "baseId": "level_boss",
          "tier": "tier_6",
          "title": "The CPU Datapath",
          "inputs": 2,
          "maxGates": 10,
          "xpReward": 500,
          "gateCount": 11,
          "file": "level_boss_easy.json"
        }
      ]
    },
    "medium": {
      "count": 20,
      "totalXP": 2890,
      "levels": [
        {
          "id": "level_01_medium",
          "baseId": "level_01",
          "tier": "tier_1",
          "title": "Dual Wire Bus",
          "inputs": 2,
          "maxGates": 2,
          "xpReward": 25,
          "gateCount": 0,
          "file": "level_01_medium.json"
        },
        {
          "id": "level_02_medium",
          "baseId": "level_02",
          "tier": "tier_1",
          "title": "Pass Gate Logic",
          "inputs": 2,
          "maxGates": 2,
          "xpReward": 30,
          "gateCount": 1,
          "file": "level_02_medium.json"
        },
        {
          "id": "level_03_medium",
          "baseId": "level_03",
          "tier": "tier_1",
          "title": "Double Negation",
          "inputs": 1,
          "maxGates": 2,
          "xpReward": 30,
          "gateCount": 2,
          "file": "level_03_medium.json"
        },
        {
          "id": "level_04_medium",
          "baseId": "level_04",
          "tier": "tier_1",
          "title": "3-Input AND (Cascade)",
          "inputs": 3,
          "maxGates": 2,
          "xpReward": 35,
          "gateCount": 3,
          "file": "level_04_medium.json"
        },
        {
          "id": "level_05_medium",
          "baseId": "level_05",
          "tier": "tier_1",
          "title": "3-Input OR (Cascade)",
          "inputs": 3,
          "maxGates": 2,
          "xpReward": 35,
          "gateCount": 4,
          "file": "level_05_medium.json"
        },
        {
          "id": "level_06_medium",
          "baseId": "level_06",
          "tier": "tier_2",
          "title": "NOR: The Other Universal",
          "inputs": 2,
          "maxGates": 2,
          "xpReward": 55,
          "gateCount": 5,
          "file": "level_06_medium.json"
        },
        {
          "id": "level_07_medium",
          "baseId": "level_07",
          "tier": "tier_2",
          "title": "AND from NAND",
          "inputs": 2,
          "maxGates": 2,
          "xpReward": 55,
          "gateCount": 1,
          "file": "level_07_medium.json"
        },
        {
          "id": "level_08_medium",
          "baseId": "level_08",
          "tier": "tier_2",
          "title": "XNOR: Equality Detector",
          "inputs": 2,
          "maxGates": 5,
          "xpReward": 60,
          "gateCount": 6,
          "file": "level_08_medium.json"
        },
        {
          "id": "level_09_medium",
          "baseId": "level_09",
          "tier": "tier_2",
          "title": "De Morgan: NOR to AND",
          "inputs": 2,
          "maxGates": 3,
          "xpReward": 70,
          "gateCount": 7,
          "file": "level_09_medium.json"
        },
        {
          "id": "level_10_medium",
          "baseId": "level_10",
          "tier": "tier_3",
          "title": "MUX as Universal Gate",
          "inputs": 2,
          "maxGates": 1,
          "xpReward": 85,
          "gateCount": 8,
          "file": "level_10_medium.json"
        },
        {
          "id": "level_11_medium",
          "baseId": "level_11",
          "tier": "tier_3",
          "title": "Decoder with Enable",
          "inputs": 3,
          "maxGates": 10,
          "xpReward": 95,
          "gateCount": 8,
          "file": "level_11_medium.json"
        },
        {
          "id": "level_12_medium",
          "baseId": "level_12",
          "tier": "tier_3",
          "title": "Half Subtractor",
          "inputs": 2,
          "maxGates": 3,
          "xpReward": 100,
          "gateCount": 8,
          "file": "level_12_medium.json"
        },
        {
          "id": "level_13_medium",
          "baseId": "level_13",
          "tier": "tier_3",
          "title": "Full Subtractor",
          "inputs": 3,
          "maxGates": 7,
          "xpReward": 115,
          "gateCount": 8,